{
  "schemaVersion": 1,
  "id": "sample-shop-recovery",
  "title": "Shop recovery baseline",
  "summary": "Example lane showing baseline-aware progress for a long-running recovery pass.",
  "scope": "Production Shops data repair",
  "status": "complete",
  "startedAt": "2026-06-19T08:49:26.000Z",
  "updatedAt": "2026-06-23T00:00:00.000Z",
  "completedAt": "2026-06-23T00:00:00.000Z",
  "progress": {
    "current": 3847,
    "total": 3847,
    "unit": "shops"
  },
  "baseline": [
    { "label": "Shops with live products", "value": 22797 },
    { "label": "Shops without live products", "value": 8443 },
    { "label": "High-signal recoverable shops", "value": 3847 }
  ],
  "metrics": [
    { "label": "Shops with live products", "value": 23063 },
    { "label": "Shops without live products", "value": 8177 },
    { "label": "Remaining high-signal recoverable shops", "value": 0 }
  ],
  "nextAction": "Done — backlog cleared.",
  "blocker": "",
  "links": [
    {
      "label": "Idea note",
      "url": "obsidian://open?vault=Boris&file=Resources%2FIdeas%2FBaseline%20Aware%20Status%20MCP"
    }
  ],
  "notes": [
    "Metadata product-count totals are upper-bound signals, not guaranteed imported rows.",
    "High-signal backlog can shrink through reclassification as well as true product recovery."
  ]
}
